market_type,market_label,security_code,security_name,peer_groups,decision_sources,watch_selection_routes,watch_reasons,calibrated_standard_implications,decided_at_utc,source_decision_files
A_SHARE,A股,601607,上海医药,医药生物-医药商业-医药商业,analyst_company_by_company_review,direct_watch,"Retained. 上海医药: Large integrated pharmaceutical industrial and commercial platform with national distribution scale, drug manufacturing, import/export, and broad product/service network. triage 66.48; moat 62.00; technology 68.83; market 78.75; quality 63.05; governance 67.18.","Retain pharma-commerce-labeled companies when company-level capability is actually an integrated pharmaceutical industrial platform, large pharma industrial-commercial platform, or scarce drug-discovery technology platform.",2026-05-15T00:00:00+00:00,data/processed/a_share_pharma_commerce_peer_group_decisions.csv
A_SHARE,A股,603233,大参林,医药生物-医药商业-医药商业,analyst_company_by_company_review,boundary_judged_watch,"Retained after boundary review. 大参林: National pharmacy-chain leader with store network, operating efficiency, and retail-pharmacy consolidation exposure. triage 66.39; moat 62.73; technology 66.06; market 70.75; quality 72.73; governance 66.09.","Boundary retention requires regulated national distribution scale, scarce product qualification, leading pharmacy-chain consolidation, strong medical-brand commercialization, diagnostics leadership, or branded drug innovation optionality.",2026-05-15T00:00:00+00:00,data/processed/a_share_pharma_commerce_peer_group_decisions.csv
A_SHARE,A股,600998,九州通,医药生物-医药商业-医药商业,analyst_company_by_company_review,boundary_judged_watch,"Retained after boundary review. 九州通: Large private pharmaceutical supply-chain platform with digital distribution, logistics, CSO, new retail, own/OEM products, and B/C integration. triage 65.24; moat 61.77; technology 66.39; market 77.30; quality 60.00; governance 65.95.","Boundary retention requires regulated national distribution scale, scarce product qualification, leading pharmacy-chain consolidation, strong medical-brand commercialization, diagnostics leadership, or branded drug innovation optionality.",2026-05-15T00:00:00+00:00,data/processed/a_share_pharma_commerce_peer_group_decisions.csv
A_SHARE,A股,600511,国药股份,医药生物-医药商业-医药商业,analyst_company_by_company_review,boundary_judged_watch,"Retained after boundary review. 国药股份: Sinopharm wholesale and medical-supply platform with public-health reserve role and regulated product scope, retained as a scarce state-backed distribution platform. triage 64.35; moat 60.64; technology 61.78; market 73.84; quality 61.64; governance 69.23.","Boundary retention requires regulated national distribution scale, scarce product qualification, leading pharmacy-chain consolidation, strong medical-brand commercialization, diagnostics leadership, or branded drug innovation optionality.",2026-05-15T00:00:00+00:00,data/processed/a_share_pharma_commerce_peer_group_decisions.csv
A_SHARE,A股,603939,益丰药房,医药生物-医药商业-医药商业,analyst_company_by_company_review,boundary_judged_watch,"Retained after boundary review. 益丰药房: National pharmacy-chain leader with strong listed-chain position, chronic-disease management, internet hospital, and retail-health platform expansion. triage 64.32; moat 59.27; technology 61.22; market 69.75; quality 72.50; governance 67.86.","Boundary retention requires regulated national distribution scale, scarce product qualification, leading pharmacy-chain consolidation, strong medical-brand commercialization, diagnostics leadership, or branded drug innovation optionality.",2026-05-15T00:00:00+00:00,data/processed/a_share_pharma_commerce_peer_group_decisions.csv
A_SHARE,A股,301015,百洋医药,医药生物-医药商业-医药商业,analyst_company_by_company_review,boundary_judged_watch,"Retained after boundary review. 百洋医药: Medical-brand commercialization and product-incubation platform with branded product operation, medical-scene optimization, and own innovation product pipeline. triage 63.99; moat 57.00; technology 69.28; market 61.75; quality 69.68; governance 66.23.","Boundary retention requires regulated national distribution scale, scarce product qualification, leading pharmacy-chain consolidation, strong medical-brand commercialization, diagnostics leadership, or branded drug innovation optionality.",2026-05-15T00:00:00+00:00,data/processed/a_share_pharma_commerce_peer_group_decisions.csv
A_SHARE,A股,000950,重药控股,医药生物-医药商业-医药商业,analyst_company_by_company_review,boundary_judged_watch,"Retained after boundary review. 重药控股: Western-China pharmaceutical distribution leader with national wholesale qualification for narcotic and class-I psychotropic drugs, fixed reserve role, and broad supply-chain coverage. triage 63.69; moat 64.55; technology 63.00; market 73.93; quality 56.50; governance 65.41.","Boundary retention requires regulated national distribution scale, scarce product qualification, leading pharmacy-chain consolidation, strong medical-brand commercialization, diagnostics leadership, or branded drug innovation optionality.",2026-05-15T00:00:00+00:00,data/processed/a_share_pharma_commerce_peer_group_decisions.csv
A_SHARE,A股,300244,迪安诊断,医药生物-医药商业-医药商业,analyst_company_by_company_review,boundary_judged_watch,"Retained after boundary review. 迪安诊断: Third-party diagnostic service leader with medical-diagnosis service network, diagnostic-product marketing, cold-chain/logistics, and precision testing capabilities, retained despite post-pandemic pricing pressure. triage 63.17; moat 57.45; technology 71.22; market 59.20; quality 61.09; governance 69.64.","Boundary retention requires regulated national distribution scale, scarce product qualification, leading pharmacy-chain consolidation, strong medical-brand commercialization, diagnostics leadership, or branded drug innovation optionality.",2026-05-15T00:00:00+00:00,data/processed/a_share_pharma_commerce_peer_group_decisions.csv
A_SHARE,A股,002727,一心堂,医药生物-医药商业-医药商业,analyst_company_by_company_review,boundary_judged_watch,"Retained after boundary review. 一心堂: Large pharmacy-chain platform with more than ten thousand direct stores, regional density, membership base, and retail-health service optionality. triage 62.43; moat 58.14; technology 64.11; market 63.57; quality 64.95; governance 68.68.","Boundary retention requires regulated national distribution scale, scarce product qualification, leading pharmacy-chain consolidation, strong medical-brand commercialization, diagnostics leadership, or branded drug innovation optionality.",2026-05-15T00:00:00+00:00,data/processed/a_share_pharma_commerce_peer_group_decisions.csv
A_SHARE,A股,301263,泰恩康,医药生物-医药商业-医药商业,analyst_company_by_company_review,boundary_judged_watch,"Retained after boundary review. 泰恩康: Branded pharmaceutical and innovation platform with GI, men health, ophthalmology, and dermatology pipeline including CKBA topical product optionality. triage 60.66; moat 53.14; technology 73.72; market 46.84; quality 68.45; governance 70.18.","Boundary retention requires regulated national distribution scale, scarce product qualification, leading pharmacy-chain consolidation, strong medical-brand commercialization, diagnostics leadership, or branded drug innovation optionality.",2026-05-15T00:00:00+00:00,data/processed/a_share_pharma_commerce_peer_group_decisions.csv
A_SHARE,A股,002270,华明装备,电气设备-输变电设备-其他输变电设备,analyst_company_by_company_review,direct_watch,Retained. 华明装备: Direct watch: transformer tap changers are a critical reliability component with long customer validation and high replacement risk. Global niche leadership and normalized margin quality justify direct watch despite low baseline algorithmic score. triage 58.28; moat 50.93; technology 57.15; market 63.29; quality 67.52; governance 69.33. Special dimension: 分接开关全球细分龙头.,"Retain power-transmission equipment companies when they own UHV/high-voltage core equipment, full transmission platforms, transformer or tap-changer leadership, inverter/power-electronics platforms, low-voltage electrical brands, or grid-qualified insulation/components that a capital-only entrant cannot quickly replicate.",2026-05-15T09:22:57+00:00,data/processed/a_share_power_transmission_equipment_peer_group_decisions.csv
A_SHARE,A股,002606,大连电瓷,电气设备-输变电设备-其他输变电设备,analyst_company_by_company_review,direct_watch,"Retained. 大连电瓷: Direct watch: high-voltage porcelain/composite insulators and arresters for transmission networks require reliability, testing, grid qualification, and manufacturing know-how. UHV line safety makes this harder than ordinary ceramic components. triage 79.40; moat 80.26; technology 92.36; market 78.87; quality 74.30; governance 70.11. Special dimension: 高压电瓷绝缘子.","Retain power-transmission equipment companies when they own UHV/high-voltage core equipment, full transmission platforms, transformer or tap-changer leadership, inverter/power-electronics platforms, low-voltage electrical brands, or grid-qualified insulation/components that a capital-only entrant cannot quickly replicate.",2026-05-15T09:22:57+00:00,data/processed/a_share_power_transmission_equipment_peer_group_decisions.csv
A_SHARE,A股,002706,良信股份,电气设备-输变电设备-其他输变电设备,analyst_company_by_company_review,direct_watch,"Retained. 良信股份: Direct watch: low-voltage electrical products, smart distribution components, and industrial/customer channels give it product and brand barriers. It is a stronger low-voltage platform than ordinary component makers. triage 58.31; moat 49.41; technology 63.87; market 65.66; quality 62.04; governance 70.11. Special dimension: 低压电器高端品牌.","Retain power-transmission equipment companies when they own UHV/high-voltage core equipment, full transmission platforms, transformer or tap-changer leadership, inverter/power-electronics platforms, low-voltage electrical brands, or grid-qualified insulation/components that a capital-only entrant cannot quickly replicate.",2026-05-15T09:22:57+00:00,data/processed/a_share_power_transmission_equipment_peer_group_decisions.csv
A_SHARE,A股,300001,特锐德,电气设备-输变电设备-其他输变电设备,analyst_company_by_company_review,direct_watch,"Retained. 特锐德: Direct watch: prefabricated substations, distribution equipment, power engineering, and Teld charging-network operations create hardware plus network/service barriers. The charging-network installed base is a distinct capability beyond ordinary switchgear. triage 81.49; moat 85.44; technology 89.21; market 96.06; quality 67.63; governance 67.67. Special dimension: 箱变与充电网络平台.","Retain power-transmission equipment companies when they own UHV/high-voltage core equipment, full transmission platforms, transformer or tap-changer leadership, inverter/power-electronics platforms, low-voltage electrical brands, or grid-qualified insulation/components that a capital-only entrant cannot quickly replicate.",2026-05-15T09:22:57+00:00,data/processed/a_share_power_transmission_equipment_peer_group_decisions.csv
A_SHARE,A股,300763,锦浪科技,电气设备-输变电设备-其他输变电设备,analyst_company_by_company_review,direct_watch,"Retained. 锦浪科技: Direct watch: string inverters for global solar markets require power electronics, firmware, certification, overseas channels, and service networks. Current solar cycle should not erase the platform quality. triage 60.78; moat 53.15; technology 65.06; market 69.73; quality 65.48; governance 67.78. Special dimension: 组串式逆变器.","Retain power-transmission equipment companies when they own UHV/high-voltage core equipment, full transmission platforms, transformer or tap-changer leadership, inverter/power-electronics platforms, low-voltage electrical brands, or grid-qualified insulation/components that a capital-only entrant cannot quickly replicate.",2026-05-15T09:22:57+00:00,data/processed/a_share_power_transmission_equipment_peer_group_decisions.csv
A_SHARE,A股,600089,特变电工,电气设备-输变电设备-其他输变电设备,analyst_company_by_company_review,direct_watch,"Retained. 特变电工: Direct watch: transformers, reactors, wires/cables, international power EPC, polysilicon, and energy-resource assets create a cross-industry grid-and-energy capability stack. Earlier doubts should not exclude this company-level moat. triage 79.26; moat 83.00; technology 85.57; market 98.00; quality 61.22; governance 68.56. Special dimension: 变压器/线缆/新能源材料综合龙头.","Retain power-transmission equipment companies when they own UHV/high-voltage core equipment, full transmission platforms, transformer or tap-changer leadership, inverter/power-electronics platforms, low-voltage electrical brands, or grid-qualified insulation/components that a capital-only entrant cannot quickly replicate.",2026-05-15T09:22:57+00:00,data/processed/a_share_power_transmission_equipment_peer_group_decisions.csv
A_SHARE,A股,600312,平高电气,电气设备-输变电设备-其他输变电设备,analyst_company_by_company_review,direct_watch,"Retained. 平高电气: Direct watch: UHV and high-voltage switchgear, GIS, breakers, and control equipment require grid qualification, safety validation, long project references, and state-grid customer trust. This is a true grid-core-equipment moat. triage 82.46; moat 88.26; technology 91.60; market 95.31; quality 65.81; governance 69.44. Special dimension: 特高压/高压开关设备.","Retain power-transmission equipment companies when they own UHV/high-voltage core equipment, full transmission platforms, transformer or tap-changer leadership, inverter/power-electronics platforms, low-voltage electrical brands, or grid-qualified insulation/components that a capital-only entrant cannot quickly replicate.",2026-05-15T09:22:57+00:00,data/processed/a_share_power_transmission_equipment_peer_group_decisions.csv
A_SHARE,A股,601179,中国西电,电气设备-输变电设备-其他输变电设备,analyst_company_by_company_review,direct_watch,"Retained. 中国西电: Direct watch: transformers, switchgear, HVDC/UHV, power electronics, EPC, and export capability form a full transmission-equipment platform. Scale, qualification, and project references make capital-only entry unrealistic. triage 81.80; moat 85.63; technology 91.98; market 96.80; quality 65.89; governance 69.33. Special dimension: 输配电成套与特高压平台.","Retain power-transmission equipment companies when they own UHV/high-voltage core equipment, full transmission platforms, transformer or tap-changer leadership, inverter/power-electronics platforms, low-voltage electrical brands, or grid-qualified insulation/components that a capital-only entrant cannot quickly replicate.",2026-05-15T09:22:57+00:00,data/processed/a_share_power_transmission_equipment_peer_group_decisions.csv
A_SHARE,A股,601877,正泰电器,电气设备-输变电设备-其他输变电设备,analyst_company_by_company_review,direct_watch,"Retained. 正泰电器: Direct watch: low-voltage electrical appliances, distribution channels, smart meters, photovoltaic/inverter/storage, and industrial internet provide brand, channel, and electrical-product breadth. It has a durable platform moat beyond one equipment niche. triage 58.71; moat 54.81; technology 53.94; market 75.51; quality 58.19; governance 66.11. Special dimension: 低压电器与能源平台.","Retain power-transmission equipment companies when they own UHV/high-voltage core equipment, full transmission platforms, transformer or tap-changer leadership, inverter/power-electronics platforms, low-voltage electrical brands, or grid-qualified insulation/components that a capital-only entrant cannot quickly replicate.",2026-05-15T09:22:57+00:00,data/processed/a_share_power_transmission_equipment_peer_group_decisions.csv
A_SHARE,A股,688032,禾迈股份,电气设备-输变电设备-其他输变电设备,analyst_company_by_company_review,direct_watch,Retained. 禾迈股份: Direct watch: microinverters and MLPE are high-value power-electronics products with certification and reliability barriers; the company deserves observation despite cyclical inverter scoring noise. triage 54.20; moat 46.81; technology 66.00; market 51.29; quality 52.67; governance 69.78. Special dimension: 微型逆变器与组件级电力电子.,"Retain power-transmission equipment companies when they own UHV/high-voltage core equipment, full transmission platforms, transformer or tap-changer leadership, inverter/power-electronics platforms, low-voltage electrical brands, or grid-qualified insulation/components that a capital-only entrant cannot quickly replicate.",2026-05-15T09:22:57+00:00,data/processed/a_share_power_transmission_equipment_peer_group_decisions.csv
A_SHARE,A股,688348,昱能科技,电气设备-输变电设备-其他输变电设备,analyst_company_by_company_review,direct_watch,"Retained. 昱能科技: Direct watch: module-level power electronics and microinverters require power-conversion efficiency, safety certification, software, global channels, and reliability. It should be judged with solar-inverter peers rather than generic distribution equipment. triage 74.95; moat 76.15; technology 95.62; market 69.09; quality 55.44; governance 71.44. Special dimension: 微型逆变器.","Retain power-transmission equipment companies when they own UHV/high-voltage core equipment, full transmission platforms, transformer or tap-changer leadership, inverter/power-electronics platforms, low-voltage electrical brands, or grid-qualified insulation/components that a capital-only entrant cannot quickly replicate.",2026-05-15T09:22:57+00:00,data/processed/a_share_power_transmission_equipment_peer_group_decisions.csv
A_SHARE,A股,688676,金盘科技,电气设备-输变电设备-其他输变电设备,analyst_company_by_company_review,direct_watch,"Retained. 金盘科技: Direct watch: dry-type transformers, energy-storage transformers, and digital power equipment for renewable energy, data centers, and industrial users combine manufacturing quality, customer qualification, and product breadth. triage 59.69; moat 53.33; technology 62.42; market 69.81; quality 61.11; governance 67.44. Special dimension: 干式变压器与新能源电力设备.","Retain power-transmission equipment companies when they own UHV/high-voltage core equipment, full transmission platforms, transformer or tap-changer leadership, inverter/power-electronics platforms, low-voltage electrical brands, or grid-qualified insulation/components that a capital-only entrant cannot quickly replicate.",2026-05-15T09:22:57+00:00,data/processed/a_share_power_transmission_equipment_peer_group_decisions.csv
A_SHARE,A股,002452,长高电新,电气设备-输变电设备-其他输变电设备,analyst_company_by_company_review,boundary_judged_watch,"Retained after boundary review. 长高电新: Boundary watch: high-voltage disconnectors, circuit breakers, complete equipment, and new-energy power equipment have grid qualification and product barriers, but scale and category control are below Pinggao/XD. triage 78.81; moat 76.89; technology 94.25; market 78.28; quality 71.15; governance 71.22. Special dimension: 高压开关与新能源电力设备.","Boundary retention requires a differentiated high-voltage switchgear, grid-protection, insulation, power-electronics, renewable transformer, special cable/component, or smart-distribution niche not already fully covered by a stronger retained peer.",2026-05-15T09:22:57+00:00,data/processed/a_share_power_transmission_equipment_peer_group_decisions.csv
A_SHARE,A股,002927,泰永长征,电气设备-输变电设备-其他输变电设备,analyst_company_by_company_review,boundary_judged_watch,"Retained after boundary review. 泰永长征: Boundary watch: low-voltage electrical, smart distribution, charging, and safety products have product and channel value, but the moat is weaker than Chint or Liangxin. triage 74.15; moat 75.41; technology 93.68; market 68.13; quality 61.78; governance 70.56. Special dimension: 低压电器与智能配电.","Boundary retention requires a differentiated high-voltage switchgear, grid-protection, insulation, power-electronics, renewable transformer, special cable/component, or smart-distribution niche not already fully covered by a stronger retained peer.",2026-05-15T09:22:57+00:00,data/processed/a_share_power_transmission_equipment_peer_group_decisions.csv
A_SHARE,A股,300447,全信股份,电气设备-输变电设备-其他输变电设备,analyst_company_by_company_review,boundary_judged_watch,"Retained after boundary review. 全信股份: Boundary watch: military-grade cables, components, and special connection products carry qualification barriers. It is retained as a special-material/electrical niche rather than a core grid-equipment leader. triage 61.26; moat 55.22; technology 73.43; market 55.36; quality 58.89; governance 71.67. Special dimension: 军工线缆与特种连接.","Boundary retention requires a differentiated high-voltage switchgear, grid-protection, insulation, power-electronics, renewable transformer, special cable/component, or smart-distribution niche not already fully covered by a stronger retained peer.",2026-05-15T09:22:57+00:00,data/processed/a_share_power_transmission_equipment_peer_group_decisions.csv
A_SHARE,A股,301291,明阳电气,电气设备-输变电设备-其他输变电设备,analyst_company_by_company_review,boundary_judged_watch,Retained after boundary review. 明阳电气: Boundary watch: transformers and complete equipment for renewable-energy and offshore/wind customers have product and customer barriers. It is promising but lacks the long category record of direct leaders. triage 57.38; moat 49.96; technology 58.64; market 68.55; quality 58.56; governance 68.56. Special dimension: 新能源变压器与成套设备.,"Boundary retention requires a differentiated high-voltage switchgear, grid-protection, insulation, power-electronics, renewable transformer, special cable/component, or smart-distribution niche not already fully covered by a stronger retained peer.",2026-05-15T09:22:57+00:00,data/processed/a_share_power_transmission_equipment_peer_group_decisions.csv
A_SHARE,A股,600550,保变电气,电气设备-输变电设备-其他输变电设备,analyst_company_by_company_review,boundary_judged_watch,"Retained after boundary review. 保变电气: Boundary watch: transformer manufacturing, UHV/power equipment, and nuclear-related qualification provide barriers, but weak operating history and stronger transformer peers limit conviction. triage 55.16; moat 49.78; technology 53.75; market 66.03; quality 54.67; governance 65.44. Special dimension: 大型变压器与核电资质.","Boundary retention requires a differentiated high-voltage switchgear, grid-protection, insulation, power-electronics, renewable transformer, special cable/component, or smart-distribution niche not already fully covered by a stronger retained peer.",2026-05-15T09:22:57+00:00,data/processed/a_share_power_transmission_equipment_peer_group_decisions.csv
A_SHARE,A股,603191,望变电气,电气设备-输变电设备-其他输变电设备,analyst_company_by_company_review,boundary_judged_watch,Retained after boundary review. 望变电气: Boundary watch: transformers plus silicon steel/non-crystalline materials create some vertical integration and materials leverage. It remains boundary because leadership versus larger transformer peers is uncertain. triage 54.59; moat 52.04; technology 55.19; market 61.73; quality 51.33; governance 66.33. Special dimension: 变压器与电工钢/非晶材料.,"Boundary retention requires a differentiated high-voltage switchgear, grid-protection, insulation, power-electronics, renewable transformer, special cable/component, or smart-distribution niche not already fully covered by a stronger retained peer.",2026-05-15T09:22:57+00:00,data/processed/a_share_power_transmission_equipment_peer_group_decisions.csv
A_SHARE,A股,603530,神马电力,电气设备-输变电设备-其他输变电设备,analyst_company_by_company_review,boundary_judged_watch,"Retained after boundary review. 神马电力: Boundary watch: composite external insulation and high-voltage insulation materials have reliability and grid-validation barriers. It is retained as a materials/component niche, smaller than direct high-voltage insulation leaders. triage 62.50; moat 54.07; technology 67.91; market 65.21; quality 69.48; governance 70.67. Special dimension: 复合绝缘子/外绝缘材料.","Boundary retention requires a differentiated high-voltage switchgear, grid-protection, insulation, power-electronics, renewable transformer, special cable/component, or smart-distribution niche not already fully covered by a stronger retained peer.",2026-05-15T09:22:57+00:00,data/processed/a_share_power_transmission_equipment_peer_group_decisions.csv
