market_type,market_label,security_code,security_name,peer_groups,decision_sources,watch_selection_routes,watch_reasons,calibrated_standard_implications,decided_at_utc,source_decision_files
A_SHARE,A股,600745,*ST闻泰,电子设备-消费电子设备-消费电子设备,analyst_company_by_company_review,direct_watch,Retained. *ST闻泰: Semiconductor and product-integration platform with power/discrete/analog semiconductor assets plus global terminal ODM capability; retained despite ST/governance-cycle risk because the capability is not ordinary consumer-electronics assembly. triage 80.85; moat 88.60; technology 96.63; market 85.37; quality 49.67; governance 69.35.,"Retain consumer-electronics companies when global platform scale, leading-customer qualification, semiconductor/system capability, or differentiated terminal ecosystem creates barriers not easily bought with capital.",2026-05-15T00:00:00+00:00,data/processed/a_share_consumer_electronics_peer_group_decisions.csv
A_SHARE,A股,688696,极米科技,电子设备-消费电子设备-消费电子设备,analyst_company_by_company_review,boundary_judged_watch,"Retained after boundary review. 极米科技: Smart-projector and laser-TV leader with optical-engine, image-quality, perception-algorithm, software, brand, and channel advantages in a focused display niche. triage 72.31; moat 69.28; technology 87.27; market 71.95; quality 62.47; governance 68.65.","Boundary retention requires a distinct brand, module, optical-display, high-end-audio, edge-AI, or digital-manufacturing niche that is not fully covered by stronger retained platforms.",2026-05-15T00:00:00+00:00,data/processed/a_share_consumer_electronics_peer_group_decisions.csv
A_SHARE,A股,601138,工业富联,电子设备-消费电子设备-消费电子设备,analyst_company_by_company_review,direct_watch,"Retained. 工业富联: Global high-end EMS, AI server, network equipment, and industrial-internet platform with scale, automation, customer qualification, and smart-factory know-how. triage 72.17; moat 70.00; technology 77.24; market 86.00; quality 56.19; governance 67.40.","Retain consumer-electronics companies when global platform scale, leading-customer qualification, semiconductor/system capability, or differentiated terminal ecosystem creates barriers not easily bought with capital.",2026-05-15T00:00:00+00:00,data/processed/a_share_consumer_electronics_peer_group_decisions.csv
A_SHARE,A股,300857,协创数据,电子设备-消费电子设备-消费电子设备,analyst_company_by_company_review,boundary_judged_watch,"Retained after boundary review. 协创数据: AIoT terminal, intelligent storage, and cloud/compute service integration platform; retained as a boundary case because the thesis depends on whether terminal-plus-cloud integration becomes durable. triage 72.15; moat 67.67; technology 79.95; market 78.09; quality 65.44; governance 66.42.","Boundary retention requires a distinct brand, module, optical-display, high-end-audio, edge-AI, or digital-manufacturing niche that is not fully covered by stronger retained platforms.",2026-05-15T00:00:00+00:00,data/processed/a_share_consumer_electronics_peer_group_decisions.csv
A_SHARE,A股,603296,华勤技术,电子设备-消费电子设备-消费电子设备,analyst_company_by_company_review,direct_watch,"Retained. 华勤技术: Global smart-product ODM platform across phones, PCs, wearables, AIoT, data-center products, and automotive electronics, with end-to-end product design and manufacturing scale. triage 71.93; moat 69.53; technology 79.20; market 84.14; quality 56.19; governance 66.84.","Retain consumer-electronics companies when global platform scale, leading-customer qualification, semiconductor/system capability, or differentiated terminal ecosystem creates barriers not easily bought with capital.",2026-05-15T00:00:00+00:00,data/processed/a_share_consumer_electronics_peer_group_decisions.csv
A_SHARE,A股,002475,立讯精密,电子设备-消费电子设备-消费电子设备,analyst_company_by_company_review,direct_watch,"Retained. 立讯精密: Consumer-electronics, automotive, and enterprise-communications component/module/system platform with global leading-customer validation and process-integration depth. triage 71.69; moat 69.77; technology 74.71; market 85.07; quality 58.42; governance 67.26.","Retain consumer-electronics companies when global platform scale, leading-customer qualification, semiconductor/system capability, or differentiated terminal ecosystem creates barriers not easily bought with capital.",2026-05-15T00:00:00+00:00,data/processed/a_share_consumer_electronics_peer_group_decisions.csv
A_SHARE,A股,300866,安克创新,电子设备-消费电子设备-消费电子设备,analyst_company_by_company_review,boundary_judged_watch,"Retained after boundary review. 安克创新: Global consumer-electronics brand operator with Anker/Soundcore/eufy/Nebula portfolio, overseas channel capability, product iteration, and user mindshare, though accessory categories remain contestable. triage 68.17; moat 60.37; technology 76.54; market 72.33; quality 69.16; governance 67.51.","Boundary retention requires a distinct brand, module, optical-display, high-end-audio, edge-AI, or digital-manufacturing niche that is not fully covered by stronger retained platforms.",2026-05-15T00:00:00+00:00,data/processed/a_share_consumer_electronics_peer_group_decisions.csv
A_SHARE,A股,002925,盈趣科技,电子设备-消费电子设备-消费电子设备,analyst_company_by_company_review,boundary_judged_watch,Retained after boundary review. 盈趣科技: UDM/UMS digital manufacturing platform serving global customers with design-to-manufacturing traceability and overseas manufacturing network; retained as a differentiated but not dominant EMS niche. triage 65.95; moat 55.98; technology 75.29; market 67.30; quality 66.65; governance 68.63.,"Boundary retention requires a distinct brand, module, optical-display, high-end-audio, edge-AI, or digital-manufacturing niche that is not fully covered by stronger retained platforms.",2026-05-15T00:00:00+00:00,data/processed/a_share_consumer_electronics_peer_group_decisions.csv
A_SHARE,A股,688036,传音控股,电子设备-消费电子设备-消费电子设备,analyst_company_by_company_review,direct_watch,"Retained. 传音控股: Emerging-market mobile-terminal brand and channel platform with localized brands, operating-system/service entry points, and distribution/after-sales advantages in under-served markets. triage 64.65; moat 58.07; technology 68.93; market 74.56; quality 57.12; governance 66.81.","Retain consumer-electronics companies when global platform scale, leading-customer qualification, semiconductor/system capability, or differentiated terminal ecosystem creates barriers not easily bought with capital.",2026-05-15T00:00:00+00:00,data/processed/a_share_consumer_electronics_peer_group_decisions.csv
A_SHARE,A股,002881,美格智能,电子设备-消费电子设备-消费电子设备,analyst_company_by_company_review,boundary_judged_watch,"Retained after boundary review. 美格智能: AI/5G intelligent module and edge-AI module platform with vertical-industry deployment, vehicle-cockpit shipments, and high-compute module know-how beyond ordinary terminal assembly. triage 64.05; moat 58.74; technology 70.85; market 64.98; quality 58.79; governance 67.93.","Boundary retention requires a distinct brand, module, optical-display, high-end-audio, edge-AI, or digital-manufacturing niche that is not fully covered by stronger retained platforms.",2026-05-15T00:00:00+00:00,data/processed/a_share_consumer_electronics_peer_group_decisions.csv
A_SHARE,A股,920183,海菲曼,电子设备-消费电子设备-消费电子设备,analyst_company_by_company_review,boundary_judged_watch,"Retained after boundary review. 海菲曼: Global high-end headphone/audio brand with HIFIMAN positioning, overseas revenue, specialist product tuning, and audiophile reputation; small niche and recent listing keep it boundary rather than direct. triage 62.61; moat 52.70; technology 68.90; market 46.65; quality 69.72; governance 70.58.","Boundary retention requires a distinct brand, module, optical-display, high-end-audio, edge-AI, or digital-manufacturing niche that is not fully covered by stronger retained platforms.",2026-05-15T00:00:00+00:00,data/processed/a_share_consumer_electronics_peer_group_decisions.csv
A_SHARE,A股,603259,药明康德,医药生物-CXO与医药研发外包,reviewer_explicit,direct_watch,Retained. 药明康德 is the CXO anchor. BIOSECURE and U.S. exposure cap confidence but do not erase the hard-to-replicate platform.,CXO core watch requires end-to-end project continuity; quality systems; global delivery; and customer trust rather than lab capacity alone.,2026-05-15T00:00:00+00:00,data/processed/a_share_cxo_peer_group_decisions.csv
A_SHARE,A股,300759,康龙化成,医药生物-CXO与医药研发外包,reviewer_explicit,direct_watch,Retained. 康龙化成 is not treated as a weak copy of 药明康德 because its lab-to-CMC conversion and clinical/CDMO breadth create a separate platform thesis.,Integrated CXO platforms can qualify when platform breadth and project conversion are visible even if they are smaller than the global leader.,2026-05-15T00:00:00+00:00,data/processed/a_share_cxo_peer_group_decisions.csv
A_SHARE,A股,002821,凯莱英,医药生物-CXO与医药研发外包,reviewer_explicit,direct_watch,Retained. 凯莱英 is the high-margin small-molecule CDMO anchor and should be monitored for customer cycle and emerging-modality execution.,High-value CDMO watch requires process know-how; quality system; commercial project history; and evidence that work is not generic manufacturing capacity.,2026-05-15T00:00:00+00:00,data/processed/a_share_cxo_peer_group_decisions.csv
A_SHARE,A股,300347,泰格医药,医药生物-CXO与医药研发外包,analyst_inferred_from_reviewer_standard,boundary_judged_watch,Retained with monitoring. 泰格医药 is kept as the clinical CRO network leader. Margin pressure and investment-income volatility should be tracked but the clinical network is a real moat.,Clinical CRO can qualify when hospital/site network; data capability; MRCT delivery; and sponsor trust are source-backed. Low-end SMO labor alone should not qualify.,2026-05-15T00:00:00+00:00,data/processed/a_share_cxo_peer_group_decisions.csv
A_SHARE,A股,603456,九洲药业,医药生物-CXO与医药研发外包,analyst_inferred_from_reviewer_standard,boundary_judged_watch,Retained with lower conviction. 九洲药业 is not stronger than 凯莱英 but has enough specialized API/CDMO depth and cash conversion to deserve observation.,Specialized CDMO/API companies can qualify beside larger anchors when process depth; regulatory quality; project pipeline; and margins prove a differentiated niche.,2026-05-15T00:00:00+00:00,data/processed/a_share_cxo_peer_group_decisions.csv
A_SHARE,A股,688131,皓元医药,医药生物-CXO与医药研发外包,analyst_inferred_from_reviewer_standard,boundary_judged_watch,Retained. 皓元医药 is kept as a front-end molecular-building-block and tool-compound platform rather than as a smaller generic CDMO.,Front-end molecule platforms can qualify when SKU breadth; synthesis know-how; customer/citation flywheel; and high-margin front-end economics are visible.,2026-05-15T00:00:00+00:00,data/processed/a_share_cxo_peer_group_decisions.csv
A_SHARE,A股,688621,阳光诺和,医药生物-CXO与医药研发外包,analyst_inferred_from_reviewer_standard,boundary_judged_watch,Retained with lower conviction. 阳光诺和 is kept as a high-margin domestic drug R&D service platform. The thesis fails if revenue proves to be mainly replaceable generic-drug outsourcing.,Domestic pharmaceutical R&D service platforms can qualify when economics and order/customer evidence show differentiated technical capability rather than simple execution labor.,2026-05-15T00:00:00+00:00,data/processed/a_share_cxo_peer_group_decisions.csv
A_SHARE,A股,000050,深天马Ａ,电子设备-电子器件-显示器件,analyst_company_by_company_review,direct_watch,"Retained. 深天马Ａ: Direct watch: Tianma has deep small-and-mid-size display, LTPS, AMOLED, automotive, industrial, and professional display capability. It has differentiated positioning versus BOE rather than being a weaker duplicate. triage 73.69; moat 69.38; technology 86.06; market 82.38; quality 59.25; governance 68.06. Special dimension: 中小尺寸/车载/专业显示平台.","Retain display companies when they own global panel leadership, differentiated small/automotive/OLED display platforms, substrate glass/material capability, or key display materials with process and customer-validation barriers.",2026-05-15T09:34:04+00:00,data/processed/a_share_display_devices_peer_group_decisions.csv
A_SHARE,A股,000725,京东方Ａ,电子设备-电子器件-显示器件,analyst_company_by_company_review,direct_watch,"Retained. 京东方Ａ: Direct watch: BOE is a global display-panel leader with LCD/OLED capacity, process know-how, customer qualification, scale, and upstream/downstream ecosystem influence. Heavy cyclicality exists, but a funded new entrant cannot quickly replicate fabs, yield learning, and customer validation. triage 66.06; moat 59.00; technology 68.81; market 78.00; quality 60.00; governance 67.62. Special dimension: 全球显示面板龙头.","Retain display companies when they own global panel leadership, differentiated small/automotive/OLED display platforms, substrate glass/material capability, or key display materials with process and customer-validation barriers.",2026-05-15T09:34:04+00:00,data/processed/a_share_display_devices_peer_group_decisions.csv
A_SHARE,A股,002876,三利谱,电子设备-电子器件-显示器件,analyst_company_by_company_review,direct_watch,"Retained. 三利谱: Direct watch: polarizer film is a key display material with coating, stretching, purification, and panel-customer qualification barriers. It is more protected than ordinary backlight or module assembly. triage 64.12; moat 55.88; technology 73.56; market 65.12; quality 62.56; governance 67.25. Special dimension: 偏光片材料.","Retain display companies when they own global panel leadership, differentiated small/automotive/OLED display platforms, substrate glass/material capability, or key display materials with process and customer-validation barriers.",2026-05-15T09:34:04+00:00,data/processed/a_share_display_devices_peer_group_decisions.csv
A_SHARE,A股,600707,彩虹股份,电子设备-电子器件-显示器件,analyst_company_by_company_review,direct_watch,"Retained. 彩虹股份: Direct watch: display panels and glass-substrate/material capability create a harder manufacturing/process barrier than ordinary module assembly. Cyclicality remains, but material and panel process assets justify observation. triage 73.83; moat 71.75; technology 80.75; market 82.12; quality 60.31; governance 70.12. Special dimension: 显示面板与基板玻璃.","Retain display companies when they own global panel leadership, differentiated small/automotive/OLED display platforms, substrate glass/material capability, or key display materials with process and customer-validation barriers.",2026-05-15T09:34:04+00:00,data/processed/a_share_display_devices_peer_group_decisions.csv
A_SHARE,A股,000045,深纺织Ａ,电子设备-电子器件-显示器件,analyst_company_by_company_review,boundary_judged_watch,"Retained after boundary review. 深纺织Ａ: Boundary watch: polarizer and optical film products have material-process barriers, but the listed company still has legacy textile/property elements and weaker scale than stronger polarizer peers. triage 69.58; moat 66.56; technology 75.19; market 73.00; quality 57.19; governance 71.44. Special dimension: 偏光片/光学膜.","Boundary retention requires a differentiated display-material, optical-film, AMOLED, microdisplay, display-equipment, touch/coating, or micro/nano optical process niche not already fully covered by stronger retained peers.",2026-05-15T09:34:04+00:00,data/processed/a_share_display_devices_peer_group_decisions.csv
A_SHARE,A股,002106,莱宝高科,电子设备-电子器件-显示器件,analyst_company_by_company_review,boundary_judged_watch,"Retained after boundary review. 莱宝高科: Boundary watch: touch panels, color filters, coated conductive glass, and vacuum coating have process and customer barriers. The niche is more mature and less strategic than core panels or polarizers. triage 66.03; moat 60.12; technology 72.00; market 71.62; quality 59.56; governance 68.38. Special dimension: 触控与导电玻璃.","Boundary retention requires a differentiated display-material, optical-film, AMOLED, microdisplay, display-equipment, touch/coating, or micro/nano optical process niche not already fully covered by stronger retained peers.",2026-05-15T09:34:04+00:00,data/processed/a_share_display_devices_peer_group_decisions.csv
A_SHARE,A股,300088,长信科技,电子设备-电子器件-显示器件,analyst_company_by_company_review,boundary_judged_watch,"Retained after boundary review. 长信科技: Boundary watch: touch display modules, ultra-thin panels, vacuum optical coating, cover glass, and automotive/display applications provide process know-how and customer validation. Competition and customer bargaining keep it boundary. triage 72.51; moat 69.06; technology 82.06; market 81.88; quality 55.81; governance 69.00. Special dimension: 触控显示与镀膜材料.","Boundary retention requires a differentiated display-material, optical-film, AMOLED, microdisplay, display-equipment, touch/coating, or micro/nano optical process niche not already fully covered by stronger retained peers.",2026-05-15T09:34:04+00:00,data/processed/a_share_display_devices_peer_group_decisions.csv
A_SHARE,A股,300331,苏大维格,电子设备-电子器件-显示器件,analyst_company_by_company_review,boundary_judged_watch,"Retained after boundary review. 苏大维格: Boundary watch: micro/nano optical processing, laser holography, photolithographic patterning, and anti-counterfeiting technologies create a differentiated optical process niche adjacent to displays. triage 63.10; moat 54.31; technology 76.75; market 57.00; quality 62.00; governance 68.19. Special dimension: 微纳光学/防伪与光刻图形技术.","Boundary retention requires a differentiated display-material, optical-film, AMOLED, microdisplay, display-equipment, touch/coating, or micro/nano optical process niche not already fully covered by stronger retained peers.",2026-05-15T09:34:04+00:00,data/processed/a_share_display_devices_peer_group_decisions.csv
A_SHARE,A股,300545,联得装备,电子设备-电子器件-显示器件,analyst_company_by_company_review,boundary_judged_watch,"Retained after boundary review. 联得装备: Boundary watch: display and semiconductor automation equipment, bonding/lamination/test tools, and OLED process equipment have process and customer-validation barriers. It is retained as an equipment niche rather than display-device leader. triage 71.82; moat 63.44; technology 87.69; market 65.00; quality 66.94; governance 70.69. Special dimension: 显示/OLED/半导体自动化设备.","Boundary retention requires a differentiated display-material, optical-film, AMOLED, microdisplay, display-equipment, touch/coating, or micro/nano optical process niche not already fully covered by stronger retained peers.",2026-05-15T09:34:04+00:00,data/processed/a_share_display_devices_peer_group_decisions.csv
A_SHARE,A股,600552,凯盛科技,电子设备-电子器件-显示器件,analyst_company_by_company_review,boundary_judged_watch,"Retained after boundary review. 凯盛科技: Boundary watch: ITO glass, coated glass, cover glass, flexible films, display modules, precision ceramics, and electronic powders give it a display-materials platform angle. Business breadth and product leadership are less clean than direct leaders. triage 72.78; moat 67.81; technology 83.88; market 77.62; quality 65.94; governance 67.88. Special dimension: 显示材料/盖板玻璃/柔性薄膜.","Boundary retention requires a differentiated display-material, optical-film, AMOLED, microdisplay, display-equipment, touch/coating, or micro/nano optical process niche not already fully covered by stronger retained peers.",2026-05-15T09:34:04+00:00,data/processed/a_share_display_devices_peer_group_decisions.csv
A_SHARE,A股,688538,和辉光电,电子设备-电子器件-显示器件,analyst_company_by_company_review,boundary_judged_watch,"Retained after boundary review. 和辉光电: Boundary watch: AMOLED panels require large capex, process know-how, yield learning, and customer qualification. It is retained despite losses because capability is scarce, but weaker scale and cycle exposure keep it boundary. triage 67.33; moat 64.50; technology 81.44; market 67.00; quality 48.62; governance 67.31. Special dimension: AMOLED面板平台.","Boundary retention requires a differentiated display-material, optical-film, AMOLED, microdisplay, display-equipment, touch/coating, or micro/nano optical process niche not already fully covered by stronger retained peers.",2026-05-15T09:34:04+00:00,data/processed/a_share_display_devices_peer_group_decisions.csv
A_SHARE,A股,688781,视涯科技,电子设备-电子器件-显示器件,analyst_company_by_company_review,boundary_judged_watch,"Retained after boundary review. 视涯科技: Boundary watch: micro-OLED and microdisplay devices have high process and customer-validation barriers and AR/VR optionality. Recent listing, small scale, and uncertain adoption keep it boundary. triage 59.52; moat 50.25; technology 76.00; market 43.00; quality 62.44; governance 66.69. Special dimension: Micro-OLED/微显示.","Boundary retention requires a differentiated display-material, optical-film, AMOLED, microdisplay, display-equipment, touch/coating, or micro/nano optical process niche not already fully covered by stronger retained peers.",2026-05-15T09:34:04+00:00,data/processed/a_share_display_devices_peer_group_decisions.csv
A_SHARE,A股,920001,纬达光电,电子设备-电子器件-显示器件,analyst_company_by_company_review,boundary_judged_watch,"Retained after boundary review. 纬达光电: Boundary watch: polarizing film and optical film products are relevant display-material niches. Scale and listing maturity are limited, so boundary only. triage 67.03; moat 60.31; technology 87.38; market 50.62; quality 51.06; governance 72.00. Special dimension: 偏光膜/光学薄膜.","Boundary retention requires a differentiated display-material, optical-film, AMOLED, microdisplay, display-equipment, touch/coating, or micro/nano optical process niche not already fully covered by stronger retained peers.",2026-05-15T09:34:04+00:00,data/processed/a_share_display_devices_peer_group_decisions.csv
A_SHARE,A股,688205,德科立,电子设备-电子元件-电子元件,analyst_company_by_company_review,boundary_judged_watch,Retained after boundary review. 德科立: Optical communication module/device supplier with coherent/high-speed optical exposure; retained as a boundary optoelectronic component case. triage 75.84; moat 75.72; technology 95.12; market 71.27; quality 64.74; governance 70.89.,"Boundary component retention requires a distinct high-reliability, high-speed, optical, RF, power, or material niche not fully covered by stronger peers.",2026-05-15T00:00:00+00:00,data/processed/a_share_electronic_components_peer_group_decisions.csv
A_SHARE,A股,300408,三环集团,电子设备-电子元件-电子元件,analyst_company_by_company_review,direct_watch,"Retained. 三环集团: Advanced ceramic components and electronic materials platform; ceramic formulation, process control, customer qualification, and scale are hard to replicate with capital alone. triage 75.55; moat 68.95; technology 85.81; market 82.42; quality 69.02; governance 71.00.","Retain electronic-component companies only when process know-how, customer qualification, material formulation, reliability record, or high-end product mix is hard to copy.",2026-05-15T00:00:00+00:00,data/processed/a_share_electronic_components_peer_group_decisions.csv
A_SHARE,A股,002916,深南电路,电子设备-电子元件-电子元件,analyst_company_by_company_review,direct_watch,"Retained. 深南电路: High-end PCB, IC substrate, and package-substrate platform with military/communication/datacenter customer qualification; retained as a PCB technology anchor. triage 75.10; moat 69.39; technology 85.28; market 83.75; quality 66.53; governance 68.53.","Retain electronic-component companies only when process know-how, customer qualification, material formulation, reliability record, or high-end product mix is hard to copy.",2026-05-15T00:00:00+00:00,data/processed/a_share_electronic_components_peer_group_decisions.csv
A_SHARE,A股,600183,生益科技,电子设备-电子元件-电子元件,analyst_company_by_company_review,direct_watch,Retained. 生益科技: Copper-clad laminate and electronic materials leader; upstream material know-how and customer qualification make it a stronger moat than downstream commodity PCB capacity. triage 74.58; moat 69.65; technology 82.09; market 84.60; quality 66.23; governance 68.63.,"Retain electronic-component companies only when process know-how, customer qualification, material formulation, reliability record, or high-end product mix is hard to copy.",2026-05-15T00:00:00+00:00,data/processed/a_share_electronic_components_peer_group_decisions.csv
